{
  "$schema": "../project.schema.json",
  "slug": "az-media",
  "cat": "identity",
  "order": 15,
  "nextSlug": "jacks-bar",
  "title": "AZ Media",
  "desc": "A wordmark that turns visibility into a visual direction",
  "blocks": [
    {
      "type": "hero",
      "variant": "centred",
      "eyebrow": "Branding · Identity",
      "title": "AZ Media",
      "lede": "A wordmark that turns visibility into a visual direction."
    },
    {
      "type": "figure",
      "src": "01.jpg",
      "width": "stage",
      "parallax": 0.1
    },
    {
      "type": "meta",
      "items": [
        {
          "label": "Client",
          "value": "AZ Media — PR agency"
        },
        {
          "label": "Role",
          "value": "Logotype, identity"
        },
        {
          "label": "Scope",
          "value": "Logotype and identity system"
        }
      ]
    },
    {
      "type": "text",
      "statement": "A PR agency should probably be good at getting noticed.",
      "body": [
        "AZ Media’s previous identity worked, but it didn’t say much. That felt like a missed opportunity for a company whose job is giving other people’s stories a distinctive voice."
      ],
      "eyebrow": "The challenge"
    },
    {
      "type": "text",
      "statement": "Turn the A into an arrow.",
      "body": [
        "The shape pushes upward while still reading immediately as part of the wordmark. A simple metaphor for visibility, momentum and moving a story forward — without bolting a separate symbol onto the side."
      ],
      "eyebrow": "The idea"
    },
    {
      "type": "gallery",
      "variant": "grid-2",
      "items": [
        {
          "src": "02.jpg"
        },
        {
          "src": "03.jpg"
        }
      ]
    },
    {
      "type": "quote",
      "variant": "aurora",
      "text": "The identity doesn’t describe the service. It behaves like it."
    },
    {
      "type": "text",
      "body": [
        "A focused wordmark construction designed to hold its confidence at presentation scale and stay solid at the smallest practical application."
      ],
      "eyebrow": "The work"
    },
    {
      "type": "gallery",
      "variant": "grid-3",
      "items": [
        {
          "src": "04.jpg"
        },
        {
          "src": "05.jpg"
        },
        {
          "src": "06.jpg"
        }
      ]
    },
    {
      "type": "figure",
      "src": "07.jpg",
      "width": "full-bleed"
    },
    {
      "type": "text",
      "body": [
        "A sharper identity with a point of view, without falling into the corporate shorthand so many agencies default to."
      ],
      "eyebrow": "The result"
    }
  ]
}
