{
  "$schema": "../project.schema.json",
  "slug": "cukier",
  "cat": "identity",
  "order": 11,
  "nextSlug": "rennes-school-of-business",
  "title": "Cukier",
  "desc": "One construction rule, multiple scales, one logotype",
  "blocks": [
    {
      "type": "hero",
      "variant": "centred",
      "eyebrow": "Branding · Packaging · Interior",
      "title": "Cukier",
      "lede": "One construction rule. Multiple scales. No separate logo for every problem."
    },
    {
      "type": "figure",
      "src": "01.jpg",
      "width": "stage",
      "parallax": 0.1
    },
    {
      "type": "meta",
      "items": [
        {
          "label": "Client",
          "value": "Cukier"
        },
        {
          "label": "Role",
          "value": "Logotype design, identity system, packaging, interior applications"
        },
        {
          "label": "Scope",
          "value": "Logotype, construction system, identity, packaging, interior"
        }
      ]
    },
    {
      "type": "text",
      "statement": "The logo had three very different jobs.",
      "body": [
        "Small packaging. Interior scale. Digital applications.",
        "A mark that works beautifully on a label can fall apart when enlarged. A mark designed for a wall can lose its character when reduced to a few centimetres. Production adds another problem: each application may be made by a different process, by different people."
      ],
      "variant": "two-column"
    },
    {
      "type": "text",
      "statement": "The idea",
      "body": [
        "Build the mark around one construction rule, then make the rule the system.",
        "Instead of drawing exceptions for every format, each application becomes a variation of the same underlying logic."
      ],
      "variant": "two-column"
    },
    {
      "type": "gallery",
      "variant": "grid-2",
      "items": [
        {
          "src": "02.jpg"
        },
        {
          "src": "03.jpg"
        }
      ]
    },
    {
      "type": "quote",
      "variant": "aurora",
      "text": "One construction rule instead of ten versions of a logo."
    },
    {
      "type": "text",
      "statement": "The work",
      "body": [
        "A documented logotype construction, identity system, packaging and interior applications built from the same foundation."
      ],
      "variant": "single"
    },
    {
      "type": "gallery",
      "variant": "grid-3",
      "items": [
        {
          "src": "04.jpg"
        },
        {
          "src": "05.jpg"
        },
        {
          "src": "06.jpg"
        }
      ]
    },
    {
      "type": "figure",
      "src": "07.jpg",
      "width": "full-bleed"
    },
    {
      "type": "text",
      "statement": "The result",
      "body": [
        "The mark holds its form from small packaging to architectural scale without needing a separate redraw for every condition.",
        "The wider point is production reality: the identity is designed to keep working even when the original designer isn’t there to check every output."
      ],
      "variant": "two-column"
    }
  ]
}
