{
  "$schema": "../project.schema.json",
  "slug": "expondo-doer",
  "cat": "brand",
  "order": 9,
  "nextSlug": "zew",
  "title": "Expondo — The DOer",
  "desc": "A company value turned into a character people can say",
  "blocks": [
    {
      "type": "hero",
      "variant": "centred",
      "eyebrow": "Brand · Internal Culture · Character Design",
      "title": "Expondo — The DOer",
      "lede": "Turn a company value into something people can actually say."
    },
    {
      "type": "figure",
      "src": "01.jpg",
      "width": "stage",
      "parallax": 0.1
    },
    {
      "type": "meta",
      "items": [
        {
          "label": "Client",
          "value": "Expondo"
        },
        {
          "label": "Role",
          "value": "Concept, naming, character design, internal communication, animation"
        },
        {
          "label": "Scope",
          "value": "Concept, naming, character system, posters, print, animation"
        }
      ]
    },
    {
      "type": "text",
      "statement": "The values sounded fine. Nobody owned them.",
      "body": [
        "Ambition. Collaboration. Accountability. The usual corporate vocabulary.",
        "The problem wasn’t that they were wrong. They were just too generic to become part of everyday conversation."
      ],
      "variant": "two-column"
    },
    {
      "type": "text",
      "statement": "The idea",
      "body": [
        "Instead of describing a value, I gave people an attitude: DO.",
        "Then I turned it into a character. The existing Expondo “DO” mark became the starting point for a mascot that could move, react and communicate rather than simply sit on a poster."
      ],
      "variant": "two-column"
    },
    {
      "type": "gallery",
      "variant": "grid-2",
      "items": [
        {
          "src": "02.jpg"
        },
        {
          "src": "03.jpg"
        }
      ]
    },
    {
      "type": "quote",
      "variant": "aurora",
      "text": "A value nobody can say out loud isn’t much of a value."
    },
    {
      "type": "text",
      "statement": "The work",
      "body": [
        "The DOer was taken from rough pencil sketches through to final animation, then extended into workplace posters, print collateral and internal communication.",
        "It stayed grounded in the existing Expondo identity: playful enough to be memorable, but never detached from a company built around real tools and real work."
      ],
      "variant": "two-column"
    },
    {
      "type": "gallery",
      "variant": "grid-3",
      "items": [
        {
          "src": "04.jpg"
        },
        {
          "src": "05.jpg"
        },
        {
          "src": "06.jpg"
        }
      ]
    },
    {
      "type": "figure",
      "src": "07.jpg",
      "width": "full-bleed"
    },
    {
      "type": "text",
      "statement": "The result",
      "body": [
        "An abstract list of values became one word people could actually use. The DOer became a recognisable internal voice for announcements, onboarding, presentations and updates.",
        "The useful part of the project wasn’t making a mascot. It was making the culture easier to recognise."
      ],
      "variant": "two-column"
    }
  ]
}
